Symbol,Name,Last Sale,Net Change,% Change,Market Cap,Country,IPO Year,Volume,Sector,Industry
A,Agilent Technologies Inc. Common Stock,$137.74 ,1.37,1.01%,40365434818,United States,1999,754945,Industrials,Biotechnology: Laboratory Analytical Instruments
AA,Alcoa Corporation Common Stock ,$36.88 ,0.94,2.62%,6622135551,United States,2016,5649329,Industrials,Aluminum
AACG,ATA Creativity Global American Depositary Shares,$0.87 ,-0.0101,-1.15%,27840113,China,2008,8586,Real Estate,Other Consumer Services
AACI,Armada Acquisition Corp. I Common Stock,$11.53 ,-0.0501,-0.43%,0,United States,2021,36228,Finance,Blank Checks
AACIW,Armada Acquisition Corp. I Warrant,$0.15 ,0.0049,3.38%,0,United States,2021,20077,Finance,Blank Checks
AACT,Ares Acquisition Corporation II Class A Ordinary Shares,$10.62 ,0,0.00%,0,,2023,59181,Finance,Blank Checks
AADI,Aadi Bioscience Inc. Common Stock,$1.75 ,0.07,4.17%,42969859,United States,,147778,Health Care,Biotechnology: Pharmaceutical Preparations
AAGR,African Agriculture Holdings Inc. Common Stock,$0.33 ,-0.0259,-7.28%,19096054,United States,2021,213526,Consumer Staples,Farming/Seeds/Milling
AAGRW,African Agriculture Holdings Inc. Warrant,$0.01 ,0,0.00%,810136,United States,2021,673,Consumer Staples,Farming/Seeds/Milling
AAL,American Airlines Group Inc. Common Stock,$13.88 ,-0.25,-1.77%,9088024606,United States,,36480842,Consumer Discretionary,Air Freight/Delivery Services
AAMC,Altisource Asset Management Corp Com,$2.91 ,-0.095,-3.16%,7433630,United States,,1820,Finance,Real Estate
AAME,Atlantic American Corporation Common Stock,$1.96 ,0.0599,3.15%,39986444,United States,,4732,Finance,Life Insurance
AAN,Aarons Holdings Company Inc. Common Stock ,$7.07 ,-0.25,-3.42%,214655338,United States,2020,183022,Consumer Discretionary,Diversified Commercial Services
AAOI,Applied Optoelectronics Inc. Common Stock,$10.85 ,0.19,1.78%,416619222,United States,2013,1510494,Technology,Semiconductors
AAON,AAON Inc. Common Stock,$91.15 ,1.25,1.39%,7436170041,United States,,367849,Industrials,Industrial Machinery/Components
AAP,Advance Auto Parts Inc.,$75.14 ,0.43,0.58%,4474665296,United States,,721664,Consumer Discretionary,Auto & Home Supply Stores
AAPL,Apple Inc. Common Stock,$169.30 ,-0.59,-0.35%,2.61431E+12,United States,1980,44732624,Technology,Computer Manufacturing
AAT,American Assets Trust Inc. Common Stock,$21.23 ,-0.01,-0.05%,1292817537,United States,2011,189100,Real Estate,Real Estate Investment Trusts
AB,AllianceBernstein Holding L.P.  Units,$33.56 ,-0.15,-0.45%,3837119214,United States,,609209,Finance,Investment Managers
ABAT,American Battery Technology Company Common Stock,$1.34 ,-0.04,-2.90%,69525808,United States,,397209,Basic Materials,Metal Mining
ABBV,AbbVie Inc. Common Stock,$159.62 ,-7.67,-4.59%,2.81964E+11,United States,2012,10708989,Health Care,Biotechnology: Pharmaceutical Preparations
ABCB,Ameris Bancorp Common Stock,$47.88 ,0.37,0.78%,3305164396,United States,1994,474982,Finance,Major Banks
ABCL,AbCellera Biologics Inc. Common Shares,$3.76 ,0.13,3.58%,1087978060,Canada,2020,1365511,Health Care,Pharmaceuticals and Biotechnology
ABEO,Abeona Therapeutics Inc. Common Stock,$3.26 ,0.07,2.19%,89177421,United States,,1207427,Health Care,Biotechnology: Pharmaceutical Preparations
ABEV,Ambev S.A. American Depositary Shares (Each representing 1 Common Share),$2.33 ,0.03,1.30%,36706431552,Brazil,2013,5889567,Consumer Staples,Beverages (Production/Distribution)
ABG,Asbury Automotive Group Inc Common Stock,$221.97 ,4.85,2.23%,4529102738,United States,2002,170337,Consumer Discretionary,Retail-Auto Dealers and Gas Stations
ABIO,ARCA biopharma Inc. Common Stock,$3.58 ,0.1,2.87%,51914092,United States,,85309,Health Care,Biotechnology: In Vitro & In Vivo Diagnostic Substances
ABL,Abacus Life Inc. Class A Common Stock,$11.93 ,-0.05,-0.42%,759878463,United States,2020,21057,Finance,Investment Managers
ABLLL,Abacus Life Inc. 9.875% Fixed Rate Senior Notes due 2028,$25.39 ,-0.06,-0.24%,1617209906,United States,,4234,Finance,Investment Managers
ABLLW,Abacus Life Inc. Warrant,$0.54 ,0.0194,3.73%,34356952,United States,2020,17225,Finance,Investment Managers
ABLV,Able View Global Inc. Class B Ordinary Shares,$1.59 ,-0.08,-4.79%,67351180,China,,51602,Consumer Discretionary,Other Consumer Services
ABM,ABM Industries Incorporated Common Stock,$44.04 ,-0.29,-0.65%,2787356955,United States,,364007,Finance,Diversified Commercial Services
ABNB,Airbnb Inc. Class A Common Stock,$164.23 ,1.22,0.75%,1.06267E+11,United States,2020,2820914,Finance,Diversified Commercial Services
ABOS,Acumen Pharmaceuticals Inc. Common Stock,$3.17 ,-0.02,-0.63%,190452896,United States,2021,140700,Health Care,Biotechnology: Biological Products (No Diagnostic Substances)
ABR,Arbor Realty Trust Common Stock,$12.82 ,0.28,2.23%,2416637484,United States,2004,2857040,Real Estate,Real Estate Investment Trusts
ABR^D,Arbor Realty Trust 6.375% Series D Cumulative Redeemable Preferred Stock Liquidation Preference $25.00 per Share,$17.94 ,0.1213,0.68%,,United States,,6050,,
ABR^E,Arbor Realty Trust 6.25% Series E Cumulative Redeemable Preferred Stock,$17.85 ,0.1028,0.58%,,United States,,2821,,
ABR^F,Arbor Realty Trust 6.25% Series F Fixed-to-Floating Rate Cumulative Redeemable Preferred Stock Liquidation Preference $25.00 per share,$18.56 ,-0.04,-0.22%,,United States,,9766,,
ABSI,Absci Corporation Common Stock,$4.58 ,0.125,2.81%,516553358,United States,2021,640076,Health Care,Biotechnology: Commercial Physical & Biological Resarch
ABT,Abbott Laboratories Common Stock,$107.53 ,0.67,0.63%,1.86584E+11,United States,,3575247,Health Care,Biotechnology: Pharmaceutical Preparations
ABTS,Abits Group Inc Ordinary Shares,$0.79 ,0.0572,7.86%,15183100,China,,13121,Technology,Computer Software: Programming Data Processing
ABUS,Arbutus Biopharma Corporation Common Stock,$2.73 ,0.01,0.37%,490013703,Canada,,406742,Health Care,Biotechnology: Pharmaceutical Preparations
ABVC,ABVC BioPharma Inc. Common Stock,$1.42 ,-0.17,-10.69%,14995798,United States,,2039853,Health Care,Biotechnology: Pharmaceutical Preparations
ABVX,Abivax SA American Depositary Shares,$15.78 ,0.04,0.25%,993195677,France,2023,53914,Health Care,Biotechnology: Pharmaceutical Preparations
AC,Associated Capital Group Inc. Common Stock,$32.33 ,-0.0375,-0.12%,694874380,United States,2015,4721,Finance,Investment Bankers/Brokers/Service
ACA,Arcosa Inc. Common Stock ,$77.34 ,0.64,0.83%,3755806658,United States,2018,169126,Industrials,Metal Fabrications
ACAB,Atlantic Coastal Acquisition Corp. II Class A Common Stock,$10.77 ,0,0.00%,0,United States,2022,386,Finance,Blank Checks
ACABU,Atlantic Coastal Acquisition Corp. II Unit,$11.00 ,0,0.00%,0,United States,2022,1,Finance,Blank Checks
ACAC,Acri Capital Acquisition Corporation Class A Common Stock,$11.20 ,0,0.00%,0,United States,2022,105,Finance,Blank Checks
ACAD,ACADIA Pharmaceuticals Inc. Common Stock,$16.71 ,0.4,2.45%,2753332116,United States,1985,1167639,Health Care,Biotechnology: Pharmaceutical Preparations
ACB,Aurora Cannabis Inc. Common Shares,$6.70 ,-0.01,-0.15%,365413819,Canada,,10092564,Health Care, Medicinal Chemicals and Botanical Products 
ACBA,Ace Global Business Acquisition Limited Ordinary Shares,$12.09 ,-0.01,-0.08%,45815623,Hong Kong,2021,103,Consumer Discretionary,Business Services
ACCD,Accolade Inc. Common Stock,$7.89 ,-1.3,-14.15%,610746019,United States,2020,1491166,Consumer Discretionary,Business Services
ACCO,Acco Brands Corporation Common Stock,$4.83 ,-0.02,-0.41%,458503786,United States,,411531,Consumer Discretionary,Publishing
ACDC,ProFrac Holding Corp. Class A Common Stock,$8.23 ,0.13,1.61%,1313460200,United States,2022,591924,Energy,Oilfield Services/Equipment
ACEL,Accel Entertainment Inc. ,$11.19 ,-0.11,-0.97%,937761098,United States,2017,145570,Consumer Discretionary,Services-Misc. Amusement & Recreation
ACET,Adicet Bio Inc. Common Stock ,$1.68 ,-0.13,-7.18%,138018693,United States,2018,1248621,Health Care,Biotechnology: Pharmaceutical Preparations
ACGL,Arch Capital Group Ltd. Common Stock,$90.90 ,-2.15,-2.31%,34010345444,Bermuda,,1458046,Finance,Property-Casualty Insurers
ACGLN,Arch Capital Group Ltd. Depositary Shares each Representing a 1/1000th Interest in a 4.550% Non-Cumulative Preferred Share Series G,$19.46 ,0.21,1.09%,7280982644,Bermuda,,24670,Finance,Property-Casualty Insurers
ACGLO,Arch Capital Group Ltd. Depositary Shares Each Representing 1/1000th Interest in a Share of 5.45% Non-Cumulative Preferred Shares Series F,$22.43 ,0,0.00%,8392211752,Bermuda,,21618,Finance,Property-Casualty Insurers
ACHC,Acadia Healthcare Company Inc. Common Stock,$73.59 ,0.21,0.29%,6791552514,United States,,689372,Health Care,Medical Specialities
ACHL,Achilles Therapeutics plc American Depositary Shares,$0.76 ,-0.0144,-1.86%,31223040,United Kingdom,2021,382132,Health Care,Biotechnology: Biological Products (No Diagnostic Substances)
ACHR,Archer Aviation Inc. Class A Common Stock,$4.02 ,0.04,1.01%,1248510640,United States,2020,3102636,Industrials,Aerospace
ACHV,Achieve Life Sciences Inc. Common Shares,$4.61 ,0.035,0.77%,157901310,United States,,57002,Health Care,Biotechnology: In Vitro & In Vivo Diagnostic Substances
ACI,Albertsons Companies Inc. Class A Common Stock,$20.13 ,0.22,1.11%,11623216256,United States,2020,1553317,Consumer Staples,Food Chains
ACIC,American Coastal Insurance Corporation Common Stock,$10.75 ,-0.19,-1.74%,513844249,United States,,105779,Finance,Property-Casualty Insurers
ACIU,AC Immune SA Common Stock,$2.35 ,0.06,2.62%,233114898,Switzerland,2016,107791,Health Care,Biotechnology: Pharmaceutical Preparations
ACIW,ACI Worldwide Inc. Common Stock,$33.30 ,0.53,1.62%,3543543443,United States,,387500,Technology,EDP Services
ACLS,Axcelis Technologies Inc. Common Stock,$103.06 ,3.06,3.06%,3362410826,United States,2000,428415,Technology,Industrial Machinery/Components
ACLX,Arcellx Inc. Common Stock,$51.92 ,0.54,1.05%,2741200407,United States,2022,339688,Health Care,Biotechnology: Biological Products (No Diagnostic Substances)
ACM,AECOM Common Stock,$94.05 ,0.46,0.49%,12793010269,United States,2007,613134,Consumer Discretionary,Military/Government/Technical
ACMR,ACM Research Inc. Class A Common Stock,$27.04 ,-1.25,-4.42%,1652009233,United States,2017,2541054,Technology,Industrial Machinery/Components
ACN,Accenture plc Class A Ordinary Shares (Ireland),$308.01 ,-0.99,-0.32%,1.93752E+11,Ireland,2001,3371667,Consumer Discretionary,Business Services
ACNB,ACNB Corporation Common Stock,$34.16 ,0.96,2.89%,290541424,United States,,6543,Finance,Major Banks
ACNT,Ascent Industries Co. Common Stock,$10.39 ,0.02,0.19%,105196475,United States,,2279,Industrials,Steel/Iron Ore
ACON,Aclarion Inc. Common Stock,$0.34 ,-0.0557,-14.18%,185203,United States,2022,3637770,Health Care,Medical Specialities
ACONW,Aclarion Inc. Warrant,$0.05 ,-0.032,-39.02%,27478,United States,2022,86090,Health Care,Medical Specialities
ACP,abrdn Income Credit Strategies Fund Common Shares,$6.52 ,0.06,0.93%,0,United States,2011,289749,Finance,Investment Managers
ACP^A,abrdn Income Credit Strategies Fund 5.250% Series A Perpetual Preferred Stock,$24.35 ,0.31,1.29%,,United States,,1227,,
ACR,ACRES Commercial Realty Corp. Common Stock,$13.74 ,0.08,0.59%,106462920,United States,,5740,Real Estate,Real Estate Investment Trusts
ACR^C,ACRES Commercial Realty Corp. 8.625% Fixed-to-Floating Series C Cumulative Redeemable Preferred Stock ,$24.05 ,-0.1112,-0.46%,,United States,,1807,,
ACR^D,ACRES Commercial Realty Corp. 7.875% Series D Cumulative Redeemable Preferred Stock,$20.58 ,-0.0016,-0.01%,,United States,,960,,
ACRE,Ares Commercial Real Estate Corporation Common Stock,$6.85 ,0.08,1.18%,372794899,United States,2012,298272,Real Estate,Real Estate Investment Trusts
ACRS,Aclaris Therapeutics Inc. Common Stock,$1.20 ,0.01,0.84%,85110050,United States,2015,445216,Health Care,Biotechnology: Pharmaceutical Preparations
ACRV,Acrivon Therapeutics Inc. Common Stock,$8.46 ,-0.01,-0.12%,261176705,United States,2022,276276,Health Care,Biotechnology: Pharmaceutical Preparations
ACST,Acasti Pharma Inc. Class A Common Stock,$2.90 ,-0.0285,-0.97%,27258272,Canada,,3826,Health Care,Biotechnology: Pharmaceutical Preparations
ACT,Enact Holdings Inc. Common Stock,$29.95 ,0.01,0.03%,4765307332,United States,2021,121173,Finance,Specialty Insurers
ACTG,Acacia Research Corporation (Acacia Tech) Common Stock,$4.87 ,-0.02,-0.41%,486490954,United States,,124753,Miscellaneous,Multi-Sector Companies
ACU,Acme United Corporation. Common Stock,$41.10 ,0.46,1.13%,149817720,United States,1988,16511,Consumer Discretionary,Industrial Machinery/Components
ACV,Virtus Diversified Income & Convertible Fund Common Shares of Beneficial Interest,$22.37 ,-0.4,-1.76%,231819281,United States,2015,57950,Finance,Finance/Investors Services
ACVA,ACV Auctions Inc. Class A Common Stock,$18.09 ,0.37,2.09%,2964798194,United States,2021,787737,Consumer Discretionary,Business Services
ACXP,Acurx Pharmaceuticals Inc. Common Stock,$2.07 ,0.05,2.48%,32617201,United States,2021,28594,Health Care,Biotechnology: Pharmaceutical Preparations
ADAG,Adagene Inc. American Depositary Shares,$2.39 ,0.04,1.70%,131798555,China,2021,24118,Health Care,Biotechnology: Pharmaceutical Preparations
ADAP,Adaptimmune Therapeutics plc American Depositary Shares,$1.08 ,0.015,1.42%,265336957,United Kingdom,2015,1162345,Health Care,Biotechnology: Pharmaceutical Preparations
ADBE,Adobe Inc. Common Stock,$477.56 ,4.12,0.87%,2.13947E+11,United States,1986,2460102,Technology,Computer Software: Prepackaged Software
ADC,Agree Realty Corporation Common Stock,$57.77 ,-0.28,-0.48%,5813161016,United States,,780912,Real Estate,Real Estate Investment Trusts
ADC^A,Agree Realty Corporation Depositary Shares each representing 1/1000th of a 4.250% Series A Cumulative Redeemable Preferred Stock,$16.75 ,-0.14,-0.83%,,United States,,10962,,
ADCT,ADC Therapeutics SA Common Shares,$4.34 ,-0.1,-2.25%,358178243,,2020,322939,Health Care,Biotechnology: Pharmaceutical Preparations
ADD,Color Star Technology Co. Ltd. Class A Ordinary Shares,$0.21 ,-0.007,-3.20%,3434114,United States,,31376,Consumer Discretionary,Engineering & Construction
ADEA,Adeia Inc. Common Stock,$10.14 ,-0.015,-0.15%,1088751301,United States,2003,270968,Technology,Semiconductors
ADI,Analog Devices Inc. Common Stock,$201.97 ,4.03,2.04%,1.00159E+11,United States,,3136250,Technology,Semiconductors
ADIL,Adial Pharmaceuticals Inc Common Stock,$1.61 ,-0.12,-6.94%,6528326,United States,2018,246194,Health Care,Biotechnology: Pharmaceutical Preparations
ADM,Archer-Daniels-Midland Company Common Stock,$60.10 ,-0.9,-1.48%,30641934095,United States,,2708560,Consumer Staples,Packaged Foods
ADMA,ADMA Biologics Inc Common Stock,$6.55 ,0.11,1.71%,1494842546,United States,,1564281,Health Care,Biotechnology: Biological Products (No Diagnostic Substances)
ADN,Advent Technologies Holdings Inc. Class A Common Stock,$0.15 ,-0.0122,-7.45%,9479735,United States,2018,921537,Miscellaneous,Industrial Machinery/Components
ADNT,Adient plc Ordinary Shares ,$30.42 ,1.01,3.43%,2775699031,United States,2016,1009356,Consumer Discretionary,Auto Parts:O.E.M.
ADNWW,Advent Technologies Holdings Inc. Warrant,$0.01 ,-0.0039,-28.26%,619059,United States,2018,252462,Utilities,Power Generation
ADP,Automatic Data Processing Inc. Common Stock,$243.07 ,-3.27,-1.33%,99850863121,United States,,1555278,Technology,EDP Services
ADPT,Adaptive Biotechnologies Corporation Common Stock,$2.60 ,-0.01,-0.38%,377239905,United States,2019,1074427,Health Care,Biotechnology: Biological Products (No Diagnostic Substances)
ADRT,Ault Disruptive Technologies Corporation Common Stock,$12.89 ,0.2,1.58%,185293750,,2022,201,Finance,Blank Checks
ADSE,ADS-TEC ENERGY PLC Ordinary Shares,$10.89 ,-0.01,-0.09%,532303200,Ireland,,13202,Consumer Discretionary,Industrial Specialties
ADSEW,ADS-TEC ENERGY PLC Warrant,$2.31 ,-0.09,-3.75%,112906244,Ireland,,3102,Consumer Discretionary,Industrial Specialties
ADSK,Autodesk Inc. Common Stock,$217.93 ,1.53,0.71%,46618566777,United States,,1277775,Technology,Computer Software: Prepackaged Software
ADT,ADT Inc. Common Stock,$6.43 ,0.1,1.58%,5930483875,United States,2018,4339250,Consumer Discretionary,Diversified Commercial Services
ADTH,AdTheorent Holding Company Inc. Common Stock,$3.25 ,-0.01,-0.31%,295439001,United States,2021,1515296,Technology,Computer Software: Programming Data Processing
ADTHW,AdTheorent Holding Company Inc. Warrants,$0.40 ,0,0.00%,36361723,United States,2021,81780,Technology,Computer Software: Programming Data Processing
ADTN,ADTRAN Holdings Inc. Common Stock,$4.43 ,-0.14,-3.06%,350482959,United States,1994,532368,Telecommunications,Telecommunications Equipment
ADTX,Aditxt Inc. Common Stock,$2.39 ,-0.14,-5.53%,3979861,United States,2020,65577,Health Care,Biotechnology: Pharmaceutical Preparations
ADUS,Addus HomeCare Corporation Common Stock,$94.54 ,2.84,3.10%,1534124310,United States,2009,205950,Health Care,Medical/Nursing Services
ADV,Advantage Solutions Inc. Class A Common Stock,$4.51 ,-0.04,-0.88%,1445125423,United States,2019,575491,Consumer Discretionary,Business Services
ADVM,Adverum Biotechnologies Inc. Common Stock,$9.19 ,-0.2,-2.13%,190737669,United States,2014,798696,Health Care,Biotechnology: Biological Products (No Diagnostic Substances)
ADVWW,Advantage Solutions Inc. Warrant,$0.12 ,-0.0138,-10.62%,37233608,United States,2019,1504,Consumer Discretionary,Business Services
ADX,Adams Diversified Equity Fund Inc.,$18.98 ,0.26,1.39%,0,United States,,112942,Finance,Investment Managers
ADXN,Addex Therapeutics Ltd American Depositary Shares,$16.10 ,0.69,4.48%,16797050,Switzerland,,21439,Health Care,Biotechnology: Pharmaceutical Preparations
AE,Adams Resources & Energy Inc. Common Stock,$29.85 ,0.65,2.23%,76614473,United States,1980,1816,Energy,Oil Refining/Marketing
AEAE,AltEnergy Acquisition Corp. Class A Common Stock,$11.20 ,0,0.00%,0,United States,2021,13,Finance,Blank Checks
AEE,Ameren Corporation Common Stock,$73.66 ,-1.1,-1.47%,19614837943,United States,,1201406,Utilities,Power Generation
AEF,abrdn Emerging Markets Equity Income Fund Inc. Common Stock,$5.04 ,0.085,1.72%,540570188,United States,,158078,Finance,Finance/Investors Services
AEFC,Aegon Funding Company LLC 5.10% Subordinated Notes due 2049,$21.32 ,0.02,0.09%,0,United States,2019,69415,,
AEG,Aegon Ltd. New York Registry Shares,$6.20 ,0.07,1.14%,13667814142,Netherlands,,2328756,Finance,Life Insurance
AEHL,Antelope Enterprise Holdings Limited Class A Ordinary Shares,$2.07 ,0.09,4.55%,3723930,China,,36872,Industrials,Building Materials
AEHR,Aehr Test Systems Common Stock,$11.47 ,0.17,1.50%,331651942,United States,1997,936290,Industrials,Electrical Products
AEI,Alset Inc. Common Stock (TX),$0.59 ,0.0197,3.46%,5447797,United States,2020,7101,Finance,Real Estate
AEIS,Advanced Energy Industries Inc. Common Stock,$95.96 ,2.18,2.33%,3581687808,United States,1995,148173,Technology,Industrial Machinery/Components
AEL,American Equity Investment Life Holding Company Common Stock,$56.31 ,0.1,0.18%,4471014450,United States,2003,337968,Finance,Life Insurance
AEL^A,American Equity Investment Life Holding Company Depositary Shares each representing a 1/1000th interest in a share of 5.95% Fixed-Rate Reset Non-Cumulative Preferred Stock Series A,$23.88 ,-0.05,-0.21%,,United States,,17493,,
AEL^B,American Equity Investment Life Holding Company Depositary Shares each representing a 1/1000th interest in a share of 6.625% Fixed-Rate Reset Non-Cumulative Preferred Stock Series B,$24.41 ,0.04,0.16%,,United States,,6956,,
AEM,Agnico Eagle Mines Limited Common Stock,$65.52 ,0.58,0.89%,32690590929,Canada,,5016839,Basic Materials,Precious Metals
AEMD,Aethlon Medical Inc. Common Stock,$1.36 ,-0.143,-9.51%,3563743,United States,,19761,Health Care,Medical/Dental Instruments
AENT,Alliance Entertainment Holding Corporation Class A Common Stock,$2.05 ,0.05,2.50%,104408079,United States,,3137,Consumer Discretionary,Durable Goods
AEO,American Eagle Outfitters Inc. Common Stock,$24.39 ,1.45,6.32%,4808647620,United States,,4093523,Consumer Discretionary,Clothing/Shoe/Accessory Stores
AEON,AEON Biopharma Inc. Class A Common Stock,$5.07 ,0.82,19.29%,191589510,United States,,133325,Health Care,Biotechnology: Pharmaceutical Preparations
AEP,American Electric Power Company Inc. Common Stock,$85.26 ,-1.6,-1.84%,44862497717,United States,,2975682,Utilities,Electric Utilities: Central
AER,AerCap Holdings N.V. Ordinary Shares,$85.49 ,0.31,0.36%,17311140932,Netherlands,2006,1510828,Consumer Discretionary,Diversified Commercial Services
AERT,Aeries Technology Inc. Class A Ordinary Share,$2.14 ,-0.03,-1.38%,33424671,United States,2021,19937,Consumer Discretionary,Professional Services
AES,The AES Corporation Common Stock,$17.21 ,0.08,0.47%,12224040698,United States,,4772193,Utilities,Electric Utilities: Central
AESI,Atlas Energy Solutions Inc. Common Stock,$23.43 ,0.27,1.17%,2343599433,United States,2023,643009,Industrials,Mining & Quarrying of Nonmetallic Minerals (No Fuels)
AEVA,Aeva Technologies Inc. Common Stock,$3.09 ,0.15,5.10%,163045132,United States,2020,187285,Consumer Discretionary,Auto Parts:O.E.M.
AEYE,AudioEye Inc. Common Stock,$14.29 ,-0.56,-3.77%,167126880,United States,,129910,Technology,EDP Services
AEZS,Aeterna Zentaris Inc. Common Stock,$1.96 ,-0.0038,-0.19%,9499065,Canada,,5110,Health Care,Pharmaceuticals and Biotechnology
AFAR,Aura FAT Projects Acquisition Corp Class A Ordinary Shares,$11.20 ,-0.03,-0.27%,0,Singapore,2022,404,Finance,Blank Checks
AFB,AllianceBernstein National Municipal Income Fund Inc,$10.46 ,0.01,0.10%,0,United States,2002,64004,Finance,Trusts Except Educational Religious and Charitable
AFBI,Affinity Bancshares Inc. Common Stock (MD),$16.77 ,-0.11,-0.65%,107606852,United States,2017,6054,Finance,Banks
AFCG,AFC Gamma Inc. Common Stock,$11.82 ,0.12,1.03%,244285051,United States,2021,56011,Finance,Real Estate
AFG,American Financial Group Inc. Common Stock,$127.34 ,-1.37,-1.06%,10653479732,United States,,352251,Finance,Property-Casualty Insurers
AFGB,American Financial Group Inc. 5.875% Subordinated Debentures due 2059,$23.10 ,-0.0479,-0.21%,1932166754,United States,2019,5220,Finance,Property-Casualty Insurers
AFGC,American Financial Group Inc. 5.125% Subordinated Debentures due 2059,$21.13 ,0.28,1.34%,1767771531,United States,2019,3042,Finance,Property-Casualty Insurers
AFGD,American Financial Group Inc. 5.625% Subordinated Debentures due 2060,$22.84 ,0.02,0.09%,1910833022,United States,2020,2847,Finance,Property-Casualty Insurers
AFGE,American Financial Group Inc. 4.500% Subordinated Debentures due 2060,$18.83 ,0.0688,0.37%,1575349642,United States,2020,18476,Finance,Property-Casualty Insurers
AFIB,Acutus Medical Inc. Common Stock,$0.17 ,0.0031,1.90%,4947708,United States,2020,247702,Health Care,Medical/Dental Instruments
AFJK,Aimei Health Technology Co. Ltd Ordinary Share,$10.28 ,0.0049,0.05%,0,United States,2024,808,,
AFL,AFLAC Incorporated Common Stock,$83.61 ,-0.12,-0.14%,48243666304,United States,,1838831,Finance,Accident &Health Insurance
AFMD,Affimed N.V.,$5.03 ,0.15,3.07%,76594139,Germany,2014,48577,Health Care,Biotechnology: Pharmaceutical Preparations
AFRI,Forafric Global PLC Ordinary Shares,$10.43 ,0.16,1.56%,280358400,Gibraltar,,2714,Consumer Staples,Packaged Foods
AFRIW,Forafric Global PLC Warrants,$1.15 ,-0.05,-4.17%,65410956,Gibraltar,,501,Consumer Staples,Packaged Foods
AFRM,Affirm Holdings Inc. Class A Common Stock,$33.33 ,1.68,5.31%,10228114420,United States,2021,6287561,Finance,Finance: Consumer Services
AFT,Apollo Senior Floating Rate Fund Inc. Common Stock,$14.20 ,0.07,0.50%,0,,2011,63951,Finance,Investment Managers
AFYA,Afya Limited Class A Common Shares,$17.94 ,0.59,3.40%,1681387570,Brazil,2019,77808,Real Estate,Other Consumer Services
AG,First Majestic Silver Corp. Ordinary Shares (Canada),$7.04 ,0.1,1.44%,2022067682,Canada,,8111333,Basic Materials,Precious Metals
AGAE,Allied Gaming & Entertainment Inc. Common Stock,$0.80 ,-0.008,-0.98%,35524814,United States,2017,15556,Consumer Discretionary,Services-Misc. Amusement & Recreation
AGBA,AGBA Group Holding Limited Ordinary Share,$2.14 ,-0.1,-4.46%,159197504,Hong Kong,2019,5028584,Finance,Investment Managers
AGBAW,AGBA Group Holding Limited Warrant,$0.15 ,-0.01,-6.25%,11158704,Hong Kong,2019,360886,Finance,Investment Managers
AGCO,AGCO Corporation Common Stock,$116.61 ,-1.06,-0.90%,8701190287,United States,,664039,Industrials,Industrial Machinery/Components
AGD,abrdn Global Dynamic Dividend Fund Common Shares of Beneficial Interest,$9.42 ,0.12,1.29%,0,United States,2006,39970,Finance,Trusts Except Educational Religious and Charitable
AGEN,Agenus Inc. Common Stock,$11.69 ,3.39,40.84%,244858787,United States,2000,3363845,Health Care,Biotechnology: Biological Products (No Diagnostic Substances)
AGFY,Agrify Corporation Common Stock,$0.29 ,-0.0054,-1.84%,3962301,United States,2021,215909,Consumer Staples,Farming/Seeds/Milling
AGI,Alamos Gold Inc. Class A Common Shares,$15.30 ,0.32,2.14%,6070593837,Canada,2015,2257562,Basic Materials,Precious Metals
AGIO,Agios Pharmaceuticals Inc. Common Stock,$31.49 ,-0.18,-0.57%,1769575732,United States,2013,419310,Health Care,Biotechnology: Pharmaceutical Preparations
AGL,agilon health inc. Common Stock,$5.00 ,-0.13,-2.53%,2047708320,United States,2021,2409005,Health Care,Misc Health and Biotechnology Services
AGM,Federal Agricultural Mortgage Corporation Common Stock,$191.03 ,1.94,1.03%,2072002692,United States,,32279,Finance,Finance Companies
AGM^C,Federal Agricultural Mortgage Corporation Preferred Series C Fixed to Fltg,$25.09 ,0.0113,0.05%,,United States,,1887,,
AGM^D,Federal Agricultural Mortgage Corporation 5.700% Non-Cumulative Preferred Stock Series D,$22.56 ,-0.12,-0.53%,,United States,,2755,,
