Symbol,Name,Last Sale,Net Change,% Change,Market Cap,Country,IPO Year,Volume,Sector,Industry
JPM^M,J P Morgan Chase & Co Depositary Shares each representing a 1/400th interest in a share of 4.20% Non-Cumulative Preferred Stock Series MM,$19.16 ,-0.034,-0.18%,,United States,,68764,,
JQC,Nuveen Credit Strategies Income Fund Shares of Beneficial Interest,$5.48 ,0.04,0.74%,0,United States,2003,442857,Finance,Finance Companies
JRI,Nuveen Real Asset Income and Growth Fund Common Shares of Beneficial Interest,$11.33 ,0.17,1.52%,0,United States,2012,163331,Finance,Finance Companies
JRS,Nuveen Real Estate Income Fund Common Shares of Beneficial Interest,$7.30 ,0.06,0.83%,0,United States,2001,110108,Finance,Finance/Investors Services
JRSH,Jerash Holdings (US) Inc. Common Stock,$3.04 ,-0.01,-0.33%,37375084,United States,2018,3965,Consumer Discretionary,Apparel
JRVR,James River Group Holdings Ltd. Common Shares,$8.99 ,-0.17,-1.86%,338564146,Bermuda,2014,390125,Finance,Property-Casualty Insurers
JSM,Navient Corporation 6% Senior Notes due December 15 2043,$19.12 ,-0.23,-1.19%,2155777782,United States,,5860,Finance,Finance: Consumer Services
JSPR,Jasper Therapeutics Inc. Common Stock,$20.40 ,-0.78,-3.68%,307303478,United States,2020,52241,Health Care,Biotechnology: Pharmaceutical Preparations
JSPRW,Japer Therapeutics Inc. Warrants,$0.15 ,0,0.00%,2221925,United States,2020,5910,Health Care,Biotechnology: Pharmaceutical Preparations
JTAI,Jet.AI Inc. Common Stock,$0.72 ,0.02,2.86%,8788924,Cayman Islands,2021,68862,Consumer Discretionary,Transportation Services
JTAIW,Jet.AI Inc. Warrant,$0.06 ,0.0068,12.90%,0,Cayman Islands,2021,1631,Consumer Discretionary,Transportation Services
JTAIZ,Jet.AI Inc. Merger Consideration Warrants,$0.45 ,-0.05,-10.00%,5492315,Cayman Islands,,597,Consumer Discretionary,Transportation Services
JUNE,Junee Limited Ordinary Shares,$4.00 ,0,0.00%,50857144,Hong Kong,2024,204162,,
JVA,Coffee Holding Co. Inc. Common Stock,$1.66 ,-0.01,-0.60%,9476274,United States,2005,52522,Consumer Staples,Packaged Foods
JVSA,JV SPAC Acquisition Corp. Class A Ordinary Share,$10.09 ,0,0.00%,0,China,2024,100,,
JVSAR,JV SPAC Acquisition Corp. Right,$0.35 ,0.03,9.38%,0,China,2024,880,,
JVSAU,JVSPAC Acquisition Corp. Unit,$10.40 ,0,0.00%,0,China,2024,20,,
JWEL,Jowell Global Ltd. Ordinary Shares,$1.10 ,0.01,0.92%,2346064,China,2021,10694,Consumer Discretionary,Other Consumer Services
JWN,Nordstrom Inc. Common Stock,$19.13 ,0.13,0.68%,3123129710,United States,,2188327,Consumer Discretionary,Clothing/Shoe/Accessory Stores
JWSM,Jaws Mustang Acquisition Corp. Class A Ordinary Shares,$11.00 ,-0.0004,0.00%,0,,2021,15764,Finance,Blank Checks
JXJT,JX Luxventure Limited Common Stock,$1.30 ,0,0.00%,7878000,China,2013,6250,Consumer Staples,Apparel
JXN,Jackson Financial Inc. Class A Common Stock ,$69.56 ,-0.02,-0.03%,5384797571,United States,2021,680165,Finance,Life Insurance
JXN^A,Jackson Financial Inc. Depositary Shares each representing a 1/1000th interest in a share of Fixed-Rate Reset Noncumulative Perpetual Preferred Stock Series A,$26.08 ,0.16,0.62%,,United States,,24859,,
JYD,Jayud Global Logistics Limited Class A Ordinary Shares,$0.91 ,-0.0055,-0.60%,19400938,China,2023,17686,Consumer Discretionary,Oil Refining/Marketing
JYNT,The Joint Corp. Common Stock,$12.23 ,0.15,1.24%,180713452,United States,2014,22943,Miscellaneous,Multi-Sector Companies
JZ,Jianzhi Education Technology Group Company Limited American Depositary Shs,$2.15 ,-0.0499,-2.27%,43397750,China,2022,2348,Real Estate,Other Consumer Services
JZXN,Jiuzi Holdings Inc. Ordinary Shares,$0.36 ,-0.0287,-7.35%,935696,China,2021,275082,Consumer Discretionary,Retail-Auto Dealers and Gas Stations
K,Kellanova Common Stock,$57.73 ,-0.72,-1.23%,19667356238,United States,,4422752,Consumer Staples,Packaged Foods
KA,Kineta Inc. Common Stock,$0.61 ,-0.0298,-4.66%,6687101,United States,2016,131913,Health Care,Biotechnology: Pharmaceutical Preparations
KACLR,Kairous Acquisition Corp. Limited Rights,$0.10 ,0,0.00%,0,Malaysia,2022,50,Finance,Blank Checks
KAI,Kadant Inc Common Stock,$282.37 ,2.79,1.00%,3309039815,United States,1992,63833,Industrials,Industrial Machinery/Components
KALA,KALA BIO Inc. Common Stock,$6.30 ,0.12,1.94%,17743660,United States,2017,5721,Health Care,Biotechnology: Pharmaceutical Preparations
KALU,Kaiser Aluminum Corporation Common Stock,$94.92 ,6.43,7.27%,1520218882,United States,,470622,Industrials,Metal Fabrications
KALV,KalVista Pharmaceuticals Inc. Common Stock,$10.78 ,0.29,2.77%,454789831,United Kingdom,2015,241417,Health Care,Biotechnology: Pharmaceutical Preparations
KAR,OPENLANE Inc. Common Stock,$17.42 ,0.04,0.23%,1882153638,United States,2009,452714,Consumer Discretionary,Retail-Auto Dealers and Gas Stations
KARO,Karooooo Ltd. Ordinary Shares,$29.80 ,0.29,0.98%,922342959,Singapore,2021,2869,Technology,Computer Software: Prepackaged Software
KAVL,Kaival Brands Innovations Group Inc. Common Stock,$4.04 ,0.46,12.85%,11566528,United States,,185060,Consumer Discretionary,Other Consumer Services
KB,KB Financial Group Inc,$54.66 ,4.51,8.99%,21297412751,South Korea,,213608,Finance,Commercial Banks
KBH,KB Home Common Stock,$65.60 ,1.33,2.07%,4980037448,United States,1986,717233,Consumer Discretionary,Homebuilding
KBR,KBR Inc. Common Stock,$65.30 ,0.06,0.09%,8820171627,United States,2006,1347854,Industrials,Military/Government/Technical
KC,Kingsoft Cloud Holdings Limited American Depositary Shares,$3.16 ,0.29,10.11%,801646663,China,2020,2198772,Technology,Computer Software: Prepackaged Software
KD,Kyndryl Holdings Inc. Common Stock,$19.49 ,-0.65,-3.23%,4484714253,United States,2021,3117808,Technology,EDP Services
KDP,Keurig Dr Pepper Inc. Common Stock,$33.72 ,-0.12,-0.36%,46789568857,United States,,9684863,Consumer Staples,Beverages (Production/Distribution)
KE,Kimball Electronics Inc. Common Stock,$20.82 ,0.02,0.10%,517776869,United States,,92658,Technology,Industrial Machinery/Components
KELYA,Kelly Services Inc. Class A Common Stock,$23.46 ,-0.25,-1.05%,827870767,United States,,127299,Consumer Discretionary,Professional Services
KELYB,Kelly Services Inc. Class B Common Stock,$23.51 ,0,0.00%,829635198,United States,,8,Consumer Discretionary,Professional Services
KEN,Kenon Holdings Ltd. Ordinary Shares,$22.25 ,0.57,2.63%,1174040051,Singapore,2015,16747,Utilities,Electric Utilities: Central
KEP,Korea Electric Power Corporation Common Stock,$7.71 ,0.04,0.52%,9899086067,South Korea,1994,34717,Utilities,Electric Utilities: Central
KEQU,Kewaunee Scientific Corporation Common Stock,$34.90 ,-1.05,-2.92%,100341130,United States,,4401,Industrials,Medical Specialities
KEX,Kirby Corporation Common Stock,$112.00 ,-0.16,-0.14%,6554464000,United States,,783584,Consumer Discretionary,Marine Transportation
KEY,KeyCorp Common Stock,$14.70 ,0.09,0.62%,13727472872,United States,,11793005,Finance,Major Banks
KEY^I,KeyCorp Depositary Shares Each Representing a 1/40th Ownership Interest in a Share of Fixed-to-Floating Rate Perpetual Non-Cumulative Preferred Stock Series E,$22.60 ,-0.15,-0.66%,,United States,,12939,,
KEY^J,KeyCorp Depositary Shares each representing a 1/40th ownership interest in a share of Fixed Rate Perpetual Non-Cumulative Preferred Stock Series F,$20.35 ,0.04,0.20%,,United States,,24047,,
KEY^K,KeyCorp Depositary Shares each representing a 1/40th ownership interest in a share of Fixed Rate Perpetual Non-Cumulative Preferred Stock Series G,$20.36 ,-0.21,-1.02%,,United States,,37061,,
KEY^L,KeyCorp Depositary Shares each representing a 1/40th ownership interest in a share of Fixed Rate Perpetual Non-Cumulative Preferred Stock Series H,$22.01 ,-0.12,-0.54%,,United States,,33471,,
KEYS,Keysight Technologies Inc. Common Stock,$148.55 ,1.12,0.76%,25930270329,United States,2014,893686,Industrials,Industrial Machinery/Components
KF,Korea Fund Inc. (The) New Common Stock,$23.74 ,0.31,1.32%,0,United States,,741,Finance,Investment Managers
KFFB,Kentucky First Federal Bancorp Common Stock,$3.90 ,0,0.00%,31538189,United States,2005,40,Finance,Savings Institutions
KFRC,Kforce Inc. Common Stock,$64.13 ,0.13,0.20%,1251689340,United States,1995,97921,Consumer Discretionary,Professional Services
KFS,Kingsway Financial Services Inc. Common Stock (DE),$8.58 ,0.05,0.59%,241280505,Canada,,14785,Finance,Property-Casualty Insurers
KFY,Korn Ferry Common Stock,$61.01 ,0.37,0.61%,3183516381,United States,1999,272334,Consumer Discretionary,Diversified Commercial Services
KGC,Kinross Gold Corporation Common Stock,$6.74 ,0.01,0.15%,8283343405,Canada,2001,14737130,,
KGEI,Kolibri Global Energy Inc. Common stock,$3.14 ,-0.01,-0.32%,111864343,United States,,3094,Energy,Oil & Gas Production
KGS,Kodiak Gas Services Inc. Common Stock,$27.89 ,0.28,1.01%,2159650353,United States,2023,211536,Utilities,Natural Gas Distribution
KHC,The Kraft Heinz Company Common Stock,$38.16 ,-0.21,-0.55%,46291887872,United States,,5342328,Consumer Staples,Packaged Foods
KIDS,OrthoPediatrics Corp. Common Stock,$30.26 ,0.32,1.07%,712607749,United States,2017,100943,Health Care,Medical/Dental Instruments
KIM,Kimco Realty Corporation (HC) Common Stock,$18.38 ,-0.04,-0.22%,12367984342,United States,,2312018,Real Estate,Real Estate Investment Trusts
KIM^L,Kimco Realty Corporation Class L Depositary Shares each of which represents a one-one thousandth fractional interest in a share of 5.125% Class L Cumulative Redeemable Preferred Stock liquidation preference $25000.00 per share,$21.82 ,0.02,0.09%,,United States,,12638,,
KIM^M,Kimco Realty Corporation Class M Depositary Shares each of which represents a one-one thousandth fractional interest in a share of 5.25% Class M Cumulative Redeemable Preferred Stock liquidation preference $25000.00 per share,$22.47 ,0.05,0.22%,,United States,,41614,,
KIM^N,Kimco Realty Corporation Depositary Shares each representing 1/1000th interest in a share of 7.25% Class N Cumulative Convertible Perpetual Preferred Stock,$54.70 ,0.6,1.11%,,United States,,8157,,
KIND,Nextdoor Holdings Inc. Class A Common Stock,$2.02 ,0.02,1.00%,795134406,United States,,759896,Technology,Computer Software: Programming Data Processing
KINS,Kingstone Companies Inc. Common Stock,$4.40 ,0.37,9.18%,48434426,United States,,21631,Finance,Property-Casualty Insurers
KIO,KKR Income Opportunities Fund Common Shares,$13.32 ,0.11,0.83%,0,,2013,89101,Finance,Investment Managers
KIRK,Kirkland's Inc. COMMONSTOCK,$1.94 ,-0.01,-0.51%,25076483,United States,2002,253195,Consumer Discretionary,Other Specialty Stores
KITT,Nauticus Robotics Inc. Common stock,$0.19 ,-0.0095,-4.76%,11797083,United States,2021,267423,Industrials,Industrial Machinery/Components
KITTW,Nauticus Robotics Inc. Warrant,$0.02 ,-0.0003,-1.71%,1074155,United States,2021,3807,Industrials,Industrial Machinery/Components
KKR,KKR & Co. Inc. Common Stock,$95.54 ,0.67,0.71%,84553728905,United States,,1965876,Finance,Investment Managers
KKRS,KKR Group Finance Co. IX LLC 4.625% Subordinated Notes due 2061,$19.08 ,0.115,0.61%,16885965538,United States,2021,27948,,
KLAC,KLA Corporation Common Stock,$706.26 ,33.31,4.95%,95510118355,United States,1980,1192906,Technology,Electronic Components
KLG,WK Kellogg Co Common Stock,$23.94 ,-0.4,-1.64%,2054472889,United States,2023,891802,Consumer Staples,Packaged Foods
KLIC,Kulicke and Soffa Industries Inc. Common Stock,$47.02 ,0.86,1.86%,2649158851,Singapore,,371542,Technology,Semiconductors
KLTR,Kaltura Inc. Common Stock,$1.25 ,0.05,4.17%,179072659,United States,2021,31839,Technology,Computer Software: Prepackaged Software
KLXE,KLX Energy Services Holdings Inc. Common Stock,$7.02 ,-0.08,-1.13%,117390672,United States,,70875,Energy,Oilfield Services/Equipment
KMB,Kimberly-Clark Corporation Common Stock,$135.24 ,-1.19,-0.87%,45536535573,United States,,2123860,Consumer Discretionary,Containers/Packaging
KMDA,Kamada Ltd. Ordinary Shares,$5.15 ,-0.05,-0.96%,230926000,Israel,2013,5461,Health Care,Biotechnology: Pharmaceutical Preparations
KMI,Kinder Morgan Inc. Common Stock,$18.68 ,-0.12,-0.64%,41458102161,United States,2011,9415373,Utilities,Natural Gas Distribution
KMPB,Kemper Corporation 5.875% Fixed-Rate Reset Junior Subordinated Debentures due 2062,$22.06 ,-0.02,-0.09%,1418980668,United States,2022,3689,Finance,Property-Casualty Insurers
KMPR,Kemper Corporation,$57.43 ,-1.28,-2.18%,3694109689,United States,,635260,Finance,Property-Casualty Insurers
KMT,Kennametal Inc. Common Stock,$24.04 ,0.28,1.18%,1905645559,United States,,385272,Industrials,Industrial Machinery/Components
KMX,CarMax Inc,$69.59 ,0.37,0.54%,10952600300,United States,,2625796,Consumer Discretionary,Other Specialty Stores
KN,Knowles Corporation Common Stock,$16.03 ,0.14,0.88%,1436766736,United States,2014,341556,Consumer Staples,Consumer Electronics/Appliances
KNDI,Kandi Technologies Group Inc. Ordinary Shares,$2.61 ,-0.08,-2.97%,228004991,China,,87467,Consumer Discretionary,Auto Manufacturing
KNF,Knife Riv Holding Co. Common Stock,$78.25 ,0.63,0.81%,4427260270,United States,2023,142331,Industrials,Mining & Quarrying of Nonmetallic Minerals (No Fuels)
KNOP,KNOT Offshore Partners LP Common Units representing Limited Partner Interests,$4.99 ,-0.07,-1.38%,169884954,United Kingdom,2013,231631,Consumer Discretionary,Marine Transportation
KNSA,Kiniksa Pharmaceuticals Ltd. Class A Common Stock,$17.88 ,0.27,1.53%,1262596593,United States,2018,331616,Health Care,Biotechnology: Pharmaceutical Preparations
KNSL,Kinsale Capital Group Inc. Common Stock,$374.64 ,-78.45,-17.31%,8687562551,United States,,803718,Finance,Property-Casualty Insurers
KNTK,Kinetik Holdings Inc. Class A Common Stock,$39.03 ,-0.17,-0.43%,5901576191,United States,2022,313889,Energy,Oil & Gas Production
KNW,Know Labs Inc. Common Stock,$0.65 ,0.0325,5.29%,52671874,,2022,52393,Industrials,Industrial Machinery/Components
KNX,Knight-Swift Transportation Holdings Inc.,$46.89 ,-0.25,-0.53%,7566592410,United States,2017,4211688,Industrials,Trucking Freight/Courier Services
KO,Coca-Cola Company (The) Common Stock,$61.74 ,0,0.00%,2.66251E+11,United States,,10988415,Consumer Staples,Beverages (Production/Distribution)
KOD,Kodiak Sciences Inc Common Stock,$3.28 ,0.095,2.98%,172228215,United States,2018,252117,Health Care,Biotechnology: Biological Products (No Diagnostic Substances)
KODK,Eastman Kodak Company Common New,$4.52 ,0.12,2.73%,361148000,United States,,356280,Consumer Discretionary,Industrial Machinery/Components
KOF,Coca Cola Femsa S.A.B. de C.V.  American Depositary Shares each representing 10 Units (each Unit consists of 3 Series B Shares and 5 Series L Shares),$99.61 ,0.94,0.95%,20926390142,Mexico,1993,127750,Consumer Staples,Beverages (Production/Distribution)
KOP,Koppers Holdings Inc. Common Stock,$52.73 ,-0.81,-1.51%,1108805913,United States,2006,76675,Basic Materials,Forest Products
KOPN,Kopin Corporation Common Stock,$0.78 ,-0.0294,-3.62%,92823869,United States,1992,3678192,Technology,Semiconductors
KORE,KORE Group Holdings Inc. Common Stock,$0.78 ,-0.0193,-2.42%,64860258,United States,,18983,Telecommunications,Telecommunications Equipment
KOS,Kosmos Energy Ltd. Common Shares (DE),$5.88 ,0.05,0.86%,2772434953,Bermuda,2011,2100751,Energy,Oil & Gas Production
KOSS,Koss Corporation Common Stock,$2.40 ,-0.026,-1.07%,22211508,United States,,12548,Consumer Staples,Consumer Electronics/Appliances
KPLT,Katapult Holdings Inc. Common Stock,$12.76 ,3.36,35.75%,51871633,United States,2019,46411,Consumer Discretionary,Diversified Commercial Services
KPLTW,Katapult Holdings Inc. Warrant,$0.01 ,0.0001,0.81%,50408,United States,2019,200,Consumer Discretionary,Diversified Commercial Services
KPRX,Kiora Pharmaceuticals Inc.  Common Stock,$0.47 ,-0.01,-2.08%,12340413,United States,,117790,Health Care,Biotechnology: Pharmaceutical Preparations
KPTI,Karyopharm Therapeutics Inc. Common Stock,$1.06 ,0,0.00%,121971108,United States,2013,660059,Miscellaneous,Diversified Commercial Services
KR,Kroger Company (The) Common Stock,$55.49 ,-0.42,-0.75%,40046458464,United States,,3470898,Consumer Staples,Food Chains
KRC,Kilroy Realty Corporation Common Stock,$33.14 ,-0.09,-0.27%,3888197227,United States,1997,799966,Real Estate,Real Estate Investment Trusts
KREF,KKR Real Estate Finance Trust Inc. Common Stock,$9.62 ,0.06,0.63%,666799333,United States,2017,580411,Real Estate,Real Estate Investment Trusts
KREF^A,KKR Real Estate Finance Trust Inc. 6.50% Series A Cumulative Redeemable Preferred Stock,$18.33 ,-0.05,-0.27%,,United States,,12373,,
KRG,Kite Realty Group Trust Common Stock,$21.26 ,-0.14,-0.65%,4665473601,United States,2004,850234,Real Estate,Real Estate Investment Trusts
KRKR,36Kr Holdings Inc. American Depositary Shares,$0.37 ,-0.0058,-1.54%,14465010,China,2019,6059,Consumer Discretionary,Business Services
KRMD,KORU Medical Systems Inc. Common Stock (DE),$2.19 ,0,0.00%,100105995,United States,,91205,Health Care,Medical/Dental Instruments
KRNL,Kernel Group Holdings Inc. Class A Ordinary Shares,$10.94 ,0,0.00%,0,United States,2021,8,Finance,Blank Checks
KRNLW,Kernel Group Holdings Inc. Warrants,$0.10 ,-0.0013,-1.30%,0,United States,2021,17312,Finance,Blank Checks
KRNT,Kornit Digital Ltd. Ordinary Shares,$15.88 ,0.67,4.41%,757787772,Israel,2015,122361,Industrials,Industrial Machinery/Components
KRNY,Kearny Financial Corp Common Stock,$5.72 ,-0.03,-0.52%,368579611,United States,2005,325114,Finance,Savings Institutions
KRO,Kronos Worldwide Inc Common Stock,$11.60 ,0.24,2.11%,1334313386,United States,,124813,Industrials,Major Chemicals
KRON,Kronos Bio Inc. Common Stock,$1.00 ,0.02,2.04%,60095013,United States,2020,442883,Health Care,Biotechnology: Pharmaceutical Preparations
KROS,Keros Therapeutics Inc. Common Stock,$57.86 ,3.67,6.77%,2081954856,United States,2020,291970,Health Care,Biotechnology: Pharmaceutical Preparations
KRP,Kimbell Royalty Partners Common Units Representing Limited Partner Interests,$16.13 ,0.09,0.56%,1527490886,United States,2017,210741,Energy,Oil & Gas Production
KRRO,Korro Bio Inc. Common Stock,$62.93 ,4.4,7.52%,504821062,United States,2019,28094,Health Care,Biotechnology: Pharmaceutical Preparations
KRT,Karat Packaging Inc. Common Stock,$27.31 ,0.25,0.92%,545436139,United States,2021,21774,Industrials,Plastic Products
KRUS,Kura Sushi USA Inc. Class A Common Stock,$113.96 ,4.65,4.25%,1279852053,United States,2019,66470,Consumer Discretionary,Restaurants
KRYS,Krystal Biotech Inc. Common Stock,$156.88 ,1.2,0.77%,4438545598,United States,2017,165898,Health Care,Biotechnology: Biological Products (No Diagnostic Substances)
KSCP,Knightscope Inc. Class A Common Stock,$0.45 ,-0.0117,-2.56%,45687296,United States,2022,987824,Telecommunications,Telecommunications Equipment
KSM,DWS Strategic Municipal Income Trust,$9.53 ,0.01,0.11%,0,United States,1989,19204,Finance,Trusts Except Educational Religious and Charitable
KSPI,Joint Stock Company Kaspi.kz American Depository Shares,$120.12 ,3.8,3.27%,22742735816,Kazakhstan,2024,233461,,
KSS,Kohl's Corporation Common Stock,$24.53 ,0.25,1.03%,2720543240,United States,1992,3807999,Consumer Discretionary,Department/Specialty Retail Stores
KT,KT Corporation Common Stock,$12.59 ,0.08,0.64%,6447154632,South Korea,,346321,Telecommunications,Telecommunications Equipment
KTB,Kontoor Brands Inc. Common Stock ,$62.20 ,0.4,0.65%,3468249110,United States,2019,700170,Consumer Discretionary,Apparel
KTCC,Key Tronic Corporation Common Stock,$4.29 ,-0.28,-6.13%,46168427,United States,1983,63130,Technology,Electrical Products
KTF,DWS Municipal Income Trust,$9.28 ,0.01,0.11%,366568705,United States,1988,56735,Finance,Finance Companies
KTH,Structures Products Cp 8% CorTS Issued by Peco Energy Cap Tr II Preferred Stock,$27.88 ,-0.61,-2.14%,0,United States,,7667,Finance,Finance: Consumer Services
KTN,Structured Products Corp 8.205% CorTS 8.205% Corporate Backed Trust Securities (CorTS),$26.98 ,0.03,0.11%,0,United States,,2083,Finance,Finance: Consumer Services
KTOS,Kratos Defense & Security Solutions Inc. Common Stock,$18.86 ,1.575,9.12%,2451101750,United States,,2874491,Industrials,Military/Government/Technical
KTRA,Kintara Therapeutics Inc. Common Stock,$0.15 ,-0.0092,-5.82%,5808839,United States,,51384907,Health Care,Biotechnology: Pharmaceutical Preparations
KTTA,Pasithea Therapeutics Corp. Common Stock,$7.24 ,0,0.00%,7547085,United States,2021,221,Health Care,Biotechnology: Pharmaceutical Preparations
KUKE,Kuke Music Holding Limited American Depositary Shares each representing one Ordinary Share,$2.50 ,-0.14,-5.30%,54464063,,2021,14712,Real Estate,Other Consumer Services
KULR,KULR Technology Group Inc. Common Stock,$0.47 ,-0.0027,-0.58%,80436089,United States,,2292694,Technology,Electrical Products
KURA,Kura Oncology Inc. Common Stock,$19.65 ,0.65,3.42%,1496091323,United States,,576890,Health Care,Biotechnology: Biological Products (No Diagnostic Substances)
KVAC,Keen Vision Acquisition Corporation Ordinary Shares,$10.50 ,0,0.00%,0,United States,2023,271,,
KVACU,Keen Vision Acquisition Corporation Units,$10.55 ,-0.01,-0.10%,0,United States,2023,120,,
KVACW,Keen Vision Acquisition Corporation Warrant,$0.07 ,0,0.00%,0,United States,2023,98,,
KVHI,KVH Industries Inc. Common Stock,$4.78 ,0.02,0.42%,93907622,United States,1996,95076,Technology,Radio And Television Broadcasting And Communications Equipment
KVUE,Kenvue Inc. Common Stock,$18.86 ,-0.16,-0.84%,36109013710,United States,2023,15451612,Consumer Discretionary,Specialty Chemicals
KVYO,Klaviyo Inc. Series A Common Stock,$23.61 ,0.59,2.56%,6167747230,United States,2023,611723,Technology,Computer Software: Prepackaged Software
KW,Kennedy-Wilson Holdings Inc. Common Stock,$8.50 ,0.04,0.47%,1181310433,United States,,538593,Finance,Real Estate
KWE,KWESST Micro Systems Inc. Common Stock,$0.70 ,-0.0098,-1.38%,4201749,Canada,,79119,,
KWESW,KWESST Micro Systems Inc. Warrant,$0.12 ,0.0002,0.17%,2059037,Canada,,501,,
KWR,Quaker Houghton Common Stock,$190.23 ,2.8,1.49%,3422575929,United States,,33823,Industrials,Major Chemicals
KXIN,Kaixin Holdings Ordinary Shares,$0.13 ,-0.0001,-0.08%,3412505,China,2017,782034,Consumer Discretionary,Retail-Auto Dealers and Gas Stations
KYMR,Kymera Therapeutics Inc. Common Stock,$33.37 ,0.02,0.06%,2039296695,United States,2020,452363,Health Care,Biotechnology: Biological Products (No Diagnostic Substances)
KYN,Kayne Anderson Energy Infrastructure Fund Inc.,$9.76 ,-0.07,-0.71%,1328643733,United States,2004,361870,Finance,Finance/Investors Services
KYTX,Kyverna Therapeutics Inc. Common Stock,$15.47 ,-0.47,-2.95%,666992825,United States,2024,705577,Health Care,Biotechnology: Biological Products (No Diagnostic Substances)
KZIA,Kazia Therapeutics Limited American Depositary Shares,$0.37 ,0,0.00%,8437077,Australia,,55572,Health Care,Biotechnology: Pharmaceutical Preparations
KZR,Kezar Life Sciences Inc. Common Stock,$0.80 ,0.0149,1.89%,58597814,United States,2018,496282,Health Care,Biotechnology: Pharmaceutical Preparations
L,Loews Corporation Common Stock,$75.46 ,-0.95,-1.24%,16767297949,United States,,568947,Finance,Property-Casualty Insurers
LAAC,Lithium Americas (Argentina) Corp. Common Shares,$5.25 ,0.36,7.36%,839569500,Canada,2023,1267127,,
LAB,Standard BioTools Inc. Common Stock,$2.44 ,0.08,3.39%,933205457,United States,2011,3639350,Industrials,Biotechnology: Laboratory Analytical Instruments
LABP,Landos Biopharma Inc. Common Stock,$22.31 ,-0.18,-0.80%,69534224,United States,2021,14876,Health Care,Biotechnology: Pharmaceutical Preparations
LAC,Lithium Americas Corp. Common Shares,$4.62 ,0.2,4.53%,742896000,Canada,2023,5354136,Basic Materials,Metal Mining
LAD,Lithia Motors Inc. Common Stock,$262.72 ,4.99,1.94%,7232927506,United States,,399224,Consumer Discretionary,Retail-Auto Dealers and Gas Stations
LADR,Ladder Capital Corp Class A Common Stock,$11.00 ,0.2,1.85%,1392789431,United States,2014,670686,Real Estate,Real Estate Investment Trusts
LAES,SEALSQ Corp Ordinary Shares,$1.23 ,0.06,5.13%,18999573,Switzerland,,303126,Technology,Semiconductors
LAKE,Lakeland Industries Inc. Common Stock,$17.15 ,0.46,2.76%,126425170,United States,1986,26492,Health Care,Industrial Specialties
LAMR,Lamar Advertising Company Class A Common Stock,$114.37 ,1.56,1.38%,11673247819,United States,1996,188581,Real Estate,Real Estate Investment Trusts
LANC,Lancaster Colony Corporation Common Stock,$187.03 ,-0.95,-0.51%,5147252630,United States,,149765,Consumer Staples,Packaged Foods
LAND,Gladstone Land Corporation Common Stock,$12.68 ,0.04,0.32%,454431445,United States,1993,108210,Real Estate,Real Estate Investment Trusts
LANDM,Gladstone Land Corporation 5.00% Series D Cumulative Term Preferred Stock,$24.05 ,-0.0124,-0.05%,861918114,United States,,1394,Real Estate,Real Estate Investment Trusts
LANDO,Gladstone Land Corporation 6.00% Series B Cumulative Redeemable Preferred Stock,$19.29 ,0,0.00%,691323546,United States,,6024,Real Estate,Real Estate Investment Trusts
LANDP,Gladstone Land Corporation 6.00% Series C Cumulative Redeemable Preferred Stock,$19.35 ,0,0.00%,693473853,United States,,5548,Real Estate,Real Estate Investment Trusts
LANV,Lanvin Group Holdings Limited Ordinary Shares,$1.59 ,-0.015,-0.94%,207589146,Cayman Islands,1996,3476,Finance,Blank Checks
LARK,Landmark Bancorp Inc. Common Stock,$19.00 ,0,0.00%,103908473,United States,,162,Finance,Major Banks
LASE,Laser Photonics Corporation Common Stock,$2.10 ,-0.09,-4.11%,19467880,United States,2022,163790,Miscellaneous,Industrial Machinery/Components
LASR,nLIGHT Inc. Common Stock,$11.56 ,0.275,2.44%,546429237,United States,2018,105067,Technology,Semiconductors
LATG,Chenghe Acquisition I Co. Class A Ordinary Shares,$11.31 ,0,0.00%,183787500,Mexico,2022,22964,Finance,Blank Checks
LATGU,Chenghe Acquisition I Co. Unit,$11.25 ,0.01,0.09%,0,Mexico,2022,1401,Finance,Blank Checks
LAUR,Laureate Education Inc. Common Stock,$14.80 ,0.35,2.42%,2332327649,United States,2017,903871,Real Estate,Other Consumer Services
