Symbol,Name,Last Sale,Net Change,% Change,Market Cap,Country,IPO Year,Volume,Sector,Industry
PSA^P,Public Storage Depositary Shares Each Representing 1/1000 of a 4.000% Cumulative Preferred Share of Bene cial Interest Series P,$17.74 ,-0.02,-0.11%,,United States,,50611,,
PSA^Q,Public Storage Depositary Shares Each Representing 1/1000 of a 3.950% Cumulative Preferred Share of Beneficial Interest Series Q par value $0.01 per share,$17.30 ,-0.01,-0.06%,,United States,,7179,,
PSA^R,Public Storage Depositary Shares Each Representing 1/1000 of a 4.00% Cumulative Preferred Share of Bene cial Interest Series R,$17.59 ,-0.07,-0.40%,,United States,,17960,,
PSA^S,Public Storage Depositary Shares Each Representing 1/1000 of a 4.100% Cumulative Preferred Share of Beneficial Interest Series S,$17.98 ,-0.05,-0.28%,,United States,,14157,,
PSBD,Palmer Square Capital BDC Inc. Common Stock,$16.43 ,-0.18,-1.08%,0,,2024,17092,,
PSEC,Prospect Capital Corporation Common Stock,$5.27 ,0.03,0.57%,2181714178,United States,2004,2394605,Finance,Finance: Consumer Services
PSEC^A,Prospect Capital Corporation 5.35% Series A Fixed Rate Cumulative Perpetual Preferred Stock,$17.53 ,0.255,1.48%,,United States,,2657,,
PSF,Cohen & Steers Select Preferred and Income Fund Inc. Common Stock,$18.84 ,0.06,0.32%,925771752,,2010,17437,Finance,Investment Managers
PSFE,Paysafe Limited Common Shares,$14.46 ,-0.04,-0.28%,892463146,,2021,227534,Consumer Discretionary,Business Services
PSHG,Performance Shipping Inc. Common Shares,$2.04 ,0.005,0.25%,25050539,Greece,,80886,Consumer Discretionary,Marine Transportation
PSMT,PriceSmart Inc. Common Stock,$81.49 ,1.32,1.65%,2498071713,United States,,182114,Consumer Discretionary,Department/Specialty Retail Stores
PSN,Parsons Corporation Common Stock,$79.73 ,0.45,0.57%,8437792334,United States,2019,430153,Technology,EDP Services
PSNL,Personalis Inc. Common Stock,$1.27 ,0.015,1.20%,63887420,United States,2019,49108,Health Care,Medical Specialities
PSNY,Polestar Automotive Holding UK PLC Class A ADS,$1.18 ,0.01,0.86%,2489731560,Sweden,,2657308,Consumer Discretionary,Auto Manufacturing
PSNYW,Polestar Automotive Holding UK PLC Class C-1 ADS (ADW),$0.14 ,-0.0161,-10.12%,301721706,Sweden,,57366,Consumer Discretionary,Auto Manufacturing
PSO,Pearson Plc Common Stock,$12.38 ,-0.04,-0.32%,8499984881,United Kingdom,,988738,Consumer Discretionary,Books
PSQH,PSQ Holdings Inc. Class A Common Stock,$4.05 ,-0.25,-5.81%,114563375,,2021,42928,Consumer Discretionary,Advertising
PSTG,Pure Storage Inc. Class A Common Stock,$52.95 ,0.73,1.40%,17204000809,United States,2015,2272429,Technology,Electronic Components
PSTL,Postal Realty Trust Inc. Class A Common Stock,$13.73 ,-0.04,-0.29%,309087398,United States,2019,40600,Real Estate,Real Estate Investment Trusts
PSTV,PLUS THERAPEUTICS Inc. Common Stock ,$1.69 ,0.025,1.50%,7226579,United States,,16331,Health Care,Medical/Dental Instruments
PSTX,Poseida Therapeutics Inc. Common Stock,$2.13 ,0.08,3.90%,205521841,United States,2020,461299,Health Care,Biotechnology: Biological Products (No Diagnostic Substances)
PSX,Phillips 66 Common Stock,$151.41 ,-5.83,-3.71%,64776896795,United States,,4206718,Energy,Integrated oil Companies
PT,Pintec Technology Holdings Limited American Depositary Shares,$1.08 ,-0.02,-1.82%,9372198,China,2018,114729,Technology,Computer Software: Programming Data Processing
PTA,Cohen & Steers Tax-Advantaged Preferred Securities and Income Fund Common Shares of Beneficial Interest,$18.48 ,0.042,0.23%,1021564032,United States,2020,87492,Finance,Trusts Except Educational Religious and Charitable
PTC,PTC Inc. Common Stock,$180.99 ,1.11,0.62%,21637789781,United States,,742701,Technology,Computer Software: Prepackaged Software
PTCT,PTC Therapeutics Inc. Common Stock,$28.57 ,3.08,12.08%,2188691417,United States,2013,1645834,Health Care,Biotechnology: Pharmaceutical Preparations
PTEN,Patterson-UTI Energy Inc. Common Stock,$11.25 ,-0.01,-0.09%,4592162655,United States,1993,5225025,Energy,Oil & Gas Production
PTGX,Protagonist Therapeutics Inc. Common Stock,$25.15 ,0.49,1.99%,1465616200,United States,2016,461248,Health Care,Biotechnology: Pharmaceutical Preparations
PTIX,Protagenic Therapeutics Inc. Common Stock,$1.39 ,-0.1837,-11.71%,6142658,United States,,10467,Health Care,Biotechnology: Pharmaceutical Preparations
PTIXW,Protagenic Therapeutics Inc. Warrant,$0.02 ,-0.0036,-13.85%,99347,United States,,730,Health Care,Biotechnology: Pharmaceutical Preparations
PTLO,Portillo's Inc. Class A Common Stock,$12.03 ,0.03,0.25%,669465458,United States,2021,811421,Consumer Discretionary,Restaurants
PTMN,Portman Ridge Finance Corporation Common Stock,$19.55 ,0.16,0.83%,182572367,United States,2006,21647,Finance,Finance/Investors Services
PTN,Palatin Technologies Inc. Common Stock,$1.82 ,0.1,5.81%,29368685,United States,1999,118925,Health Care,Biotechnology: Pharmaceutical Preparations
PTON,Peloton Interactive Inc. Class A Common Stock,$3.16 ,0.13,4.29%,1159317903,United States,2019,10240855,Consumer Discretionary,Recreational Games/Products/Toys
PTPI,Petros Pharmaceuticals Inc. Common Stock,$0.64 ,0,0.00%,4399833,United States,,77210,Health Care,Biotechnology: Pharmaceutical Preparations
PTSI,P.A.M. Transportation Services Inc. Common Stock,$16.84 ,-0.31,-1.81%,371065392,United States,1986,24842,Industrials,Trucking Freight/Courier Services
PTVE,Pactiv Evergreen Inc. Common stock,$15.53 ,0.27,1.77%,2772991546,United States,2020,235891,Consumer Discretionary,Containers/Packaging
PTWO,Pono Capital Two Inc. Class A Common Stock,$14.99 ,0.44,3.02%,0,United States,2022,236,Finance,Blank Checks
PTWOU,Pono Capital Two Inc. Unit,$15.00 ,0.49,3.38%,0,United States,2022,327,Finance,Blank Checks
PTWOW,Pono Capital Two Inc. Warrants,$0.07 ,0.0102,17.06%,0,United States,2022,936820,Finance,Blank Checks
PTY,Pimco Corporate & Income Opportunity Fund,$14.13 ,0.2,1.44%,0,United States,2002,894038,Finance,Investment Managers
PUBM,PubMatic Inc. Class A Common Stock,$23.21 ,0.4,1.75%,1160698538,United States,2020,259554,Technology,Computer Software: Programming Data Processing
PUCK,Goal Acquisitions Corp. Common Stock,$10.74 ,0,0.00%,0,United States,2021,15,Finance,Blank Checks
PUCKU,Goal Acquisitions Corp. Unit,$10.45 ,0,0.00%,0,United States,2021,127,Finance,Blank Checks
PUCKW,Goal Acquisitions Corp. Warrant,$0.01 ,-0.0003,-4.11%,0,United States,2021,159,Finance,Blank Checks
PUK,Prudential Public Limited Company Common Stock,$18.31 ,0.16,0.88%,25208482521,United Kingdom,,964833,Finance,Life Insurance
PULM,Pulmatrix Inc. Common Stock,$2.04 ,-0.04,-1.92%,7450661,United States,2014,6762,Health Care,Biotechnology: Pharmaceutical Preparations
PUMP,ProPetro Holding Corp. Common Stock,$8.98 ,0.24,2.75%,965952325,United States,2017,937430,Energy,Oilfield Services/Equipment
PVBC,Provident Bancorp Inc. (MD) Common Stock,$8.88 ,-0.46,-4.93%,156813216,United States,2015,44594,Finance,Banks
PVH,PVH Corp. Common Stock,$111.03 ,0.24,0.22%,6405199455,United States,,811773,Consumer Discretionary,Apparel
PVL,Permianville Royalty Trust Trust Units ,$1.63 ,-0.03,-1.81%,53790000,United States,2011,107625,Energy,Oil & Gas Production
PW,Power REIT (MD) Common Stock,$0.44 ,-0.0602,-12.14%,1477214,United States,1998,145643,Real Estate,Real Estate Investment Trusts
PW^A,Power REIT 7.75% Series A Cumulative Perpetual Preferred Stock,$3.00 ,0,0.00%,,United States,,330,,
PWFL,PowerFleet Inc. Common Stock,$4.53 ,0.2,4.62%,488872377,United States,,964822,Telecommunications,Telecommunications Equipment
PWM,Prestige Wealth Inc. Class A Ordinary Shares,$1.07 ,-0.061,-5.40%,9781350,Hong Kong,2023,44390,Finance,Finance: Consumer Services
PWOD,Penns Woods Bancorp Inc. Common Stock,$17.52 ,-0.085,-0.48%,131605923,United States,,21073,Finance,Major Banks
PWP,Perella Weinberg Partners Class A Common Stock,$15.32 ,-0.29,-1.86%,1322488062,United States,2020,720083,Finance,Finance: Consumer Services
PWR,Quanta Services Inc. Common Stock,$261.66 ,6.47,2.54%,38136677060,United States,,1179949,Industrials,Engineering & Construction
PWSC,PowerSchool Holdings Inc. Class A Common Stock,$17.57 ,0.19,1.09%,3559565247,United States,2021,601389,Technology,Computer Software: Prepackaged Software
PWUP,PowerUp Acquisition Corp. Class A Ordinary Shares,$11.15 ,0,0.00%,0,United States,2022,55619,Finance,Blank Checks
PWUPU,PowerUp Acquisition Corp. Unit,$11.12 ,0,0.00%,0,United States,2022,1,Finance,Blank Checks
PWUPW,PowerUp Acquisition Corp. Warrant,$0.03 ,0,0.00%,0,United States,2022,75,Finance,Blank Checks
PX,P10 Inc. Class A Common Stock,$7.46 ,0.06,0.81%,864443427,United States,2021,1111469,Finance,Investment Managers
PXD,Pioneer Natural Resources Company Common Stock,$268.87 ,-6.28,-2.28%,62814248543,United States,,2059137,Energy,Oil & Gas Production
PXDT,Pixie Dust Technologies Inc. American Depositary Shares ,$2.51 ,-0.08,-3.09%,36902690,Japan,2023,2317,Health Care,Biotechnology: Electromedical & Electrotherapeutic Apparatus
PXLW,Pixelworks Inc.  Common Stock,$1.78 ,0.08,4.71%,102878434,United States,2000,217257,Technology,Semiconductors
PXMD,PaxMedica Inc. Common Stock,$0.74 ,0.0356,5.06%,5480488,United States,2022,499227,Health Care,Biotechnology: Pharmaceutical Preparations
PXS,Pyxis Tankers Inc. Common Stock,$4.53 ,0.055,1.23%,47705025,Greece,,20077,Consumer Discretionary,Marine Transportation
PXSAP,Pyxis Tankers Inc. 7.75% Series A Cumulative Convertible Preferred Shares,$24.60 ,0.0999,0.41%,259345602,Greece,,869,Consumer Discretionary,Marine Transportation
PXSAW,Pyxis Tankers Inc. Warrant,$1.10 ,0,0.00%,11596802,Greece,,2,Consumer Discretionary,Marine Transportation
PYCR,Paycor HCM Inc. Common Stock,$17.86 ,0.24,1.36%,3179616764,United States,2021,702529,Technology,Computer Software: Prepackaged Software
PYN,PIMCO New York Municipal Income Fund III Common Shares of Beneficial Interest,$5.72 ,0.01,0.18%,0,United States,2002,14289,Finance,Investment Managers
PYPD,PolyPid Ltd. Ordinary Shares,$4.75 ,-0.054,-1.12%,7858539,Israel,2020,2321,Health Care,Medical/Dental Instruments
PYPL,PayPal Holdings Inc. Common Stock,$65.96 ,1.86,2.90%,70692093349,United States,,14192796,Consumer Discretionary,Business Services
PYT,PPlus Tr GSC-2 Tr Ctf Fltg Rate,$22.85 ,0,0.00%,0,United States,,100,Finance,Finance: Consumer Services
PYXS,Pyxis Oncology Inc. Common Stock,$4.30 ,0,0.00%,249973513,United States,2021,163531,Health Care,Biotechnology: Pharmaceutical Preparations
PZC,PIMCO California Municipal Income Fund III Common Shares of Beneficial Interest,$7.06 ,0.03,0.43%,0,United States,2002,44034,Finance,Investment Managers
PZG,Paramount Gold Nevada Corp. Common Stock,$0.44 ,0.0033,0.75%,26765726,United States,2015,40168,Basic Materials,Precious Metals
PZZA,Papa John's International Inc. Common Stock,$63.10 ,0.19,0.30%,2067602306,United States,1993,551955,Consumer Discretionary,Restaurants
QBTS,D-Wave Quantum Inc. Common Shares,$1.44 ,-0.04,-2.70%,232822259,,2022,3533646,Technology,EDP Services
QCOM,QUALCOMM Incorporated Common Stock,$165.66 ,2.36,1.45%,1.84877E+11,United States,1991,7140396,Technology,Radio And Television Broadcasting And Communications Equipment
QCRH,QCR Holdings Inc. Common Stock,$56.21 ,-1.33,-2.31%,943927785,United States,,89785,Finance,Major Banks
QD,Qudian Inc. American Depositary Shares each representing one Class A Ordinary Share,$2.46 ,0.03,1.24%,571325962,China,2017,656734,Finance,Finance: Consumer Services
QDEL,QuidelOrtho Corporation Common Stock,$39.64 ,-0.05,-0.13%,2649913784,United States,,546985,Health Care,Biotechnology: In Vitro & In Vivo Diagnostic Substances
QDRO,Quadro Acquisition One Corp. Class A Ordinary Shares,$11.02 ,0,0.00%,0,United States,2021,901,Finance,Blank Checks
QETA,Quetta Acquisition Corporation Common Stock,$10.21 ,0,0.00%,0,United States,2023,2,,
QETAR,Quetta Acquisition Corporation Right,$1.25 ,0,0.00%,0,United States,2023,4,,
QFIN,Qifu Technology Inc. American Depositary Shares,$18.52 ,-0.35,-1.86%,2989054513,China,2018,1469931,Finance,Finance: Consumer Services
QGEN,Qiagen N.V. Common Shares,$41.65 ,0.57,1.39%,9504644746,Netherlands,,1406780,Health Care,Biotechnology: Biological Products (No Diagnostic Substances)
QH,Quhuo Limited American Depository Shares,$0.55 ,-0.0105,-1.87%,3392192,China,2020,157913,Consumer Discretionary,Business Services
QIPT,Quipt Home Medical Corp. Common Shares,$3.66 ,0,0.00%,154095044,United States,,97997,,
QLGN,Qualigen Therapeutics Inc. Common Stock,$0.29 ,-0.0065,-2.19%,1832291,United States,2015,9216,Health Care,Biotechnology: Pharmaceutical Preparations
QLI,Qilian International Holding Group Ltd. Ordinary Shares,$0.75 ,-0.0404,-5.12%,26762450,China,2021,12148,Health Care,Biotechnology: Pharmaceutical Preparations
QLYS,Qualys Inc. Common Stock,$170.36 ,0.62,0.37%,6299445843,United States,2012,261623,Technology,EDP Services
QMCO,Quantum Corporation Common Stock,$0.42 ,-0.0053,-1.25%,39917055,United States,,116077,Technology,Electronic Components
QNCX,Quince Therapeutics Inc. Common Stock,$1.06 ,0.03,2.91%,45808147,United States,2019,120833,Health Care,Biotechnology: Biological Products (No Diagnostic Substances)
QNRX,Quoin Pharmaceuticals Ltd. American Depositary Shares,$0.64 ,0.0075,1.19%,2349806,Israel,2016,55083,Health Care,Medical/Dental Instruments
QNST,QuinStreet Inc. Common Stock,$17.31 ,0.36,2.12%,950154642,United States,2010,371576,Consumer Discretionary,Business Services
QQQX,Nuveen NASDAQ 100 Dynamic Overwrite Fund Shares of Beneficial Interest,$23.00 ,0.31,1.37%,0,United States,,92080,Finance,Finance Companies
QRHC,Quest Resource Holding Corporation Common Stock,$9.60 ,0.26,2.78%,193645440,United States,,49425,Utilities,Environmental Services
QRTEA,Qurate Retail Inc. Series A Common Stock ,$0.90 ,-0.0784,-8.00%,353004213,United States,,5991087,Consumer Discretionary,Catalog/Specialty Distribution
QRTEB,Qurate Retail Inc. Series B Common Stock ,$4.09 ,0.09,2.25%,1602249729,United States,,30373,Consumer Discretionary,Catalog/Specialty Distribution
QRTEP,Qurate Retail Inc. 8.0% Fixed Rate Cumulative Redeemable Preferred Stock,$46.08 ,-0.52,-1.12%,18051752448,United States,,14053,Consumer Discretionary,Catalog/Specialty Distribution
QRVO,Qorvo Inc. Common Stock,$116.75 ,2.05,1.79%,11272032472,United States,,1042948,Technology,Semiconductors
QS,QuantumScape Corporation Class A Common Stock,$5.39 ,0.29,5.69%,2672412785,United States,2020,8891864,Miscellaneous,Industrial Machinery/Components
QSG,QuantaSing Group Limited American Depositary Shares,$3.43 ,0.13,3.94%,189357101,China,2023,62875,Real Estate,Other Consumer Services
QSI,Quantum-Si Incorporated Class A Common Stock,$1.65 ,0.04,2.48%,233920363,United States,2020,357756,Industrials,Industrial Machinery/Components
QSIAW,Quantum-Si Incorporated Warrant,$0.23 ,-0.0047,-2.00%,32607081,United States,2020,26092,Industrials,Industrial Machinery/Components
QSR,Restaurant Brands International Inc. Common Shares,$73.82 ,0.75,1.03%,23052762729,Canada,2014,1306254,Consumer Discretionary,Restaurants
QTI,QT Imaging Holdings Inc. Common Stock,$0.82 ,0.0099,1.22%,17576373,United States,,53337,Health Care,Biotechnology: Electromedical & Electrotherapeutic Apparatus
QTRX,Quanterix Corporation Common Stock,$15.56 ,-0.03,-0.19%,592269896,United States,2017,258697,Industrials,Biotechnology: Laboratory Analytical Instruments
QTTB,Q32 Bio Inc. Common Stock,$28.02 ,-0.22,-0.78%,90494541,United States,2018,28395,Health Care,Biotechnology: Pharmaceutical Preparations
QTWO,Q2 Holdings Inc. Common Stock,$53.28 ,0.39,0.74%,3147473962,United States,2014,316768,Technology,EDP Services
QUAD,Quad Graphics Inc Class A Common Stock,$4.52 ,-0.07,-1.53%,236315241,United States,,96997,Consumer Discretionary,Publishing
QUBT,Quantum Computing Inc. Common Stock,$0.75 ,-0.0016,-0.21%,68737488,United States,,738092,Technology,Computer Manufacturing
QUIK,QuickLogic Corporation Common Stock,$14.33 ,1.2,9.14%,206026551,United States,1999,381141,Technology,Semiconductors
QURE,uniQure N.V. Ordinary Shares,$4.53 ,-0.01,-0.22%,216707386,Netherlands,2014,354544,Health Care,Biotechnology: Pharmaceutical Preparations
QVCC,QVC Inc. 6.250% Senior Secured Notes due 2068,$12.20 ,-0.2,-1.61%,12,United States,2019,28850,Consumer Discretionary,Catalog/Specialty Distribution
QVCD,QVC Inc. 6.375% Senior Secured Notes due 2067,$12.48 ,0.08,0.65%,12,United States,2018,2851,Consumer Discretionary,Catalog/Specialty Distribution
R,Ryder System Inc. Common Stock,$121.95 ,-0.48,-0.39%,5344921306,United States,,224612,Consumer Discretionary,Rental/Leasing Companies
RA,Brookfield Real Assets Income Fund Inc. Common Stock,$12.51 ,0.03,0.24%,0,United States,2016,180880,Finance,Investment Managers
RACE,Ferrari N.V. Common Shares,$422.46 ,10.25,2.49%,76219426301,Italy,2015,217490,Consumer Discretionary,Auto Manufacturing
RAIL,FreightCar America Inc. Common Stock,$3.60 ,0.05,1.41%,66043757,United States,2005,16912,Industrials,Railroads
RAMP,LiveRamp Holdings Inc. Common Stock,$32.64 ,0.65,2.03%,2160236980,United States,2018,648474,Technology,EDP Services
RAND,Rand Capital Corporation Common Stock,$14.19 ,0.2902,2.09%,36624688,United States,,3406,Finance,Finance: Consumer Services
RANI,Rani Therapeutics Holdings Inc. Class A Common Stock,$6.68 ,0.12,1.83%,335050711,United States,2021,42066,Health Care,Biotechnology: Pharmaceutical Preparations
RAPT,RAPT Therapeutics Inc. Common Stock,$8.10 ,0.3,3.85%,281861386,United States,2019,466015,Health Care,Biotechnology: Pharmaceutical Preparations
RARE,Ultragenyx Pharmaceutical Inc. Common Stock,$44.24 ,0.39,0.89%,3642530793,United States,2014,450422,Health Care,Biotechnology: Pharmaceutical Preparations
RAVE,Rave Restaurant Group Inc. Common Stock,$2.10 ,-0.0004,-0.02%,30625954,United States,,10266,Consumer Discretionary,Restaurants
RAYA,Erayak Power Solution Group Inc. Class A Ordinary Shares,$0.69 ,0.041,6.28%,8640300,China,2022,28423,Consumer Discretionary,Metal Fabrications
RBA,RB Global Inc. Common Stock,$73.18 ,-0.15,-0.21%,13393167229,Canada,,456708,,
RBB,RBB Bancorp Common Stock,$18.06 ,-0.015,-0.08%,336216256,United States,2017,31194,Finance,Major Banks
RBBN,Ribbon Communications Inc. Common Stock,$3.13 ,-0.11,-3.40%,539805199,United States,,589265,Technology,EDP Services
RBC,RBC Bearings Incorporated Common Stock,$245.03 ,0.78,0.32%,7150446103,United States,2022,130048,Industrials,Metal Fabrications
RBCAA,Republic Bancorp Inc. Class A Common Stock,$50.50 ,0.45,0.90%,979843824,United States,1998,18238,Finance,Major Banks
RBCP,RBC Bearings Incorporated 5.00% Series A Mandatory Convertible Preferred Stock,$112.37 ,0.21,0.19%,3279172463,United States,2022,2293,Industrials,Metal Fabrications
RBKB,Rhinebeck Bancorp Inc. Common Stock,$7.61 ,0.0334,0.44%,84262539,United States,2019,1599,Finance,Banks
RBLX,Roblox Corporation Class A Common Stock,$36.01 ,0.48,1.35%,22745292482,United States,2021,3745401,Technology,Computer Software: Prepackaged Software
RBOT,Vicarious Surgical Inc. Class A Common Stock,$0.27 ,0.007,2.66%,47452952,Hong Kong,2020,334163,Health Care,Industrial Specialties
RBRK,Rubrik Inc. Class A Common Stock,$38.00 ,1,2.70%,0,,2024,5098071,,
RBT,Rubicon Technologies Inc. Class A Common Stock,$0.46 ,0.0629,16.04%,24323247,,2022,782543,Technology,Computer Software: Prepackaged Software
RC,Ready Capital Corproation Common Stock,$8.85 ,0.15,1.72%,1527107537,United States,2013,961578,Real Estate,Real Estate Investment Trusts
RC^C,Ready Capital Corporation 6.25% Series C Cumulative Convertible Preferred Stock,$17.75 ,0.01,0.06%,,United States,,3751,,
RC^E,Ready Capital Corporation 6.50% Series E Cumulative Redeemable Preferred Stock,$18.18 ,-0.0737,-0.40%,,United States,,4897,,
RCAT,Red Cat Holdings Inc. Common Stock,$1.39 ,-0.07,-4.80%,103251313,United States,,1046160,Technology,Computer Software: Prepackaged Software
RCB,Ready Capital Corporation 6.20% Senior Notes due 2026,$23.92 ,-0.15,-0.62%,4127504214,United States,2019,24508,Real Estate,Real Estate Investment Trusts
RCC,Ready Capital Corporation 5.75% Senior Notes due 2026,$24.18 ,-0.17,-0.70%,4172368390,United States,2021,10053,Real Estate,Real Estate Investment Trusts
RCEL,Avita Medical Inc. Common Stock,$8.52 ,0.22,2.65%,219020760,United States,,285980,Health Care,Medical/Dental Instruments
RCFA,RCF Acquisition Corp. Class A Ordinary Shares,$11.20 ,0,0.00%,0,,2021,118,Finance,Blank Checks
RCG,RENN Fund Inc Common Stock,$1.62 ,0.02,1.25%,0,United States,,2206,Finance,Investment Managers
RCI,Rogers Communication Inc. Common Stock,$37.96 ,-0.08,-0.21%,20166803039,Canada,,1265055,Telecommunications,Cable & Other Pay Television Services
RCKT,Rocket Pharmaceuticals Inc. Common Stock,$21.98 ,-0.12,-0.54%,1989283371,United States,2015,878742,Health Care,Biotechnology: Pharmaceutical Preparations
RCKTW,Rocket Pharmaceuticals Inc. Warrant,$0.10 ,-0.01,-9.17%,,United States,,33679,Health Care,Biotechnology: Pharmaceutical Preparations
RCKY,Rocky Brands Inc. Common Stock,$26.49 ,-0.09,-0.34%,196490794,United States,1993,25021,Consumer Discretionary,Shoe Manufacturing
RCL,Royal Caribbean Cruises Ltd. Common Stock,$140.59 ,3.12,2.27%,36082444167,United States,1993,2758440,Consumer Discretionary,Marine Transportation
RCM,R1 RCM Inc. Common Stock,$11.90 ,0.08,0.68%,5001334785,United States,,1475834,Consumer Discretionary,Other Consumer Services
RCMT,RCM Technologies Inc. Common Stock,$18.97 ,0.06,0.32%,150610778,United States,,76074,Consumer Discretionary,Professional Services
RCON,Recon Technology Ltd. Class A Ordinary Shares,$0.09 ,0.009,10.98%,3688068,China,2009,12175004,Energy,Oilfield Services/Equipment
RCRT,Recruiter.com Group Inc. Common Stock,$1.40 ,0,0.00%,2047598,United States,,2335,Technology,EDP Services
RCRTW,Recruiter.com Group Inc. Warrant,$0.01 ,0.0026,50.98%,11262,United States,,7375,Technology,EDP Services
RCS,PIMCO Strategic Income Fund Inc.,$5.69 ,-0.005,-0.09%,0,United States,1994,57879,Finance,Investment Managers
RCUS,Arcus Biosciences Inc. Common Stock,$15.55 ,0.82,5.57%,1412948091,United States,2018,505353,Health Care,Biotechnology: Pharmaceutical Preparations
RDCM,Radcom Ltd. Ordinary Shares,$8.66 ,0,0.00%,132564959,Israel,1997,32515,Technology,Computer peripheral equipment
RDDT,Reddit Inc. Class A Common Stock,$45.43 ,2.98,7.02%,7223056079,,2024,2760054,Technology,EDP Services
RDFN,Redfin Corporation Common Stock,$5.62 ,0.44,8.49%,670137376,United States,2017,3929656,Finance,Real Estate
RDHL,Redhill Biopharma Ltd. American Depositary Shares,$0.43 ,0.0118,2.84%,13639074,Israel,,218881,Health Care,Biotechnology: Pharmaceutical Preparations
RDI,Reading International Inc Class A Common Stock,$1.65 ,0.01,0.61%,36887029,United States,,15319,Consumer Discretionary,Movies/Entertainment
RDIB,Reading International Inc Class B Common Stock,$15.58 ,-0.12,-0.76%,348302975,United States,,842,Consumer Discretionary,Movies/Entertainment
RDN,Radian Group Inc. Common Stock,$30.35 ,0.04,0.13%,4597967274,United States,,551740,Finance,Property-Casualty Insurers
RDNT,RadNet Inc. Common Stock,$48.40 ,-0.45,-0.92%,3314211441,United States,,289735,Health Care,Medical Specialities
RDUS,Radius Recycling Inc. Class A Common Stock,$17.90 ,-0.24,-1.32%,500880682,United States,,206220,Consumer Discretionary,Industrial Specialties
RDVT,Red Violet Inc. Common Stock ,$16.99 ,0.01,0.06%,237248836,United States,,27322,Technology,Computer Software: Prepackaged Software
RDW,Redwire Corporation Common Stock,$3.96 ,0.11,2.86%,259691747,United States,2021,66381,Industrials,Military/Government/Technical
RDWR,Radware Ltd. Ordinary Shares,$17.03 ,-0.17,-0.99%,710131858,Israel,1999,296916,Consumer Discretionary,Business Services
RDY,Dr. Reddy's Laboratories Ltd Common Stock,$74.55 ,0.53,0.72%,12414653156,India,,216218,Health Care,Biotechnology: Pharmaceutical Preparations
RDZN,Roadzen Inc. Ordinary Shares,$4.84 ,-0.33,-6.38%,331253612,United States,2022,23800,Finance,Specialty Insurers
REAL,The RealReal Inc. Common Stock,$3.59 ,0.19,5.59%,375845755,United States,2019,1717622,Consumer Discretionary,Consumer Specialties
REAX,The Real Brokerage Inc. Common Shares,$3.83 ,0.13,3.51%,703210141,Canada,,422153,Finance,Real Estate
REBN,Reborn Coffee Inc. Common Stock,$1.37 ,-0.0138,-1.00%,3711109,United States,2022,17596,Consumer Discretionary,Restaurants
REE,REE Automotive Ltd. Class A Ordinary Shares,$4.10 ,-0.22,-5.09%,46054603,Israel,,4018,Consumer Discretionary,Auto Manufacturing
REFI,Chicago Atlantic Real Estate Finance Inc. Common Stock,$15.65 ,0.09,0.58%,284786055,United States,2021,70197,Real Estate,Real Estate Investment Trusts
REFR,Research Frontiers Incorporated Common Stock,$1.59 ,-0.02,-1.24%,53279766,United States,,89343,Miscellaneous,Multi-Sector Companies
REG,Regency Centers Corporation Common Stock,$58.28 ,-0.78,-1.32%,10757238127,United States,1993,1398371,Real Estate,Real Estate Investment Trusts
REGCO,Regency Centers Corporation 5.875% Series B Cumulative Redeemable Preferred Stock,$22.11 ,-0.41,-1.82%,4081031829,United States,,1558,,
REGCP,Regency Centers Corporation 6.25% Series A Cumulative Redeemable Preferred Stock,$23.02 ,0.2,0.88%,4248998313,United States,,4007,,
REGN,Regeneron Pharmaceuticals Inc. Common Stock,$883.20 ,-7.48,-0.84%,96941706547,United States,1991,505652,Health Care,Biotechnology: Pharmaceutical Preparations
REI,Ring Energy Inc. Common Stock,$2.00 ,0.01,0.50%,395868404,United States,,1150056,Energy,Oil & Gas Production
REKR,Rekor Systems Inc. Common Stock,$1.79 ,0.04,2.29%,152731603,United States,,411025,Telecommunications,Telecommunications Equipment
RELI,Reliance Global Group Inc. Common Stock,$0.27 ,-0.014,-5.00%,1514175,United States,,140659,Finance,Specialty Insurers
RELIW,Reliance Global Group Inc. Series A Warrants,$0.11 ,-0.0048,-4.18%,626163,United States,,1119,Finance,Specialty Insurers
